[
  {
    "facultad": "Facultad de Arquitectura",
    "carrera": "Arquitectura",
    "ciclo": "NA",
    "total": 211
  },
  {
    "facultad": "Facultad de Ciencias Empresariales",
    "carrera": "Administración",
    "ciclo": "NA",
    "total": 497
  },
  {
    "facultad": "Facultad de Ciencias Empresariales",
    "carrera": "Contabilidad y Finanzas",
    "ciclo": "NA",
    "total": 84
  },
  {
    "facultad": "Facultad de Ciencias Empresariales",
    "carrera": "Marketing",
    "ciclo": "NA",
    "total": 213
  },
  {
    "facultad": "Facultad de Ciencias Empresariales",
    "carrera": "Negocios Internacionales",
    "ciclo": "NA",
    "total": 384
  },
  {
    "facultad": "Facultad de Comunicación",
    "carrera": "Comunicación",
    "ciclo": "NA",
    "total": 436
  },
  {
    "facultad": "Facultad de Derecho",
    "carrera": "Derecho",
    "ciclo": "NA",
    "total": 512
  },
  {
    "facultad": "Facultad de Economía",
    "carrera": "Economía",
    "ciclo": "NA",
    "total": 259
  },
  {
    "facultad": "Facultad de Ingeniería",
    "carrera": "Ingeniería Civil",
    "ciclo": "NA",
    "total": 245
  },
  {
    "facultad": "Facultad de Ingeniería",
    "carrera": "Ingeniería Industrial",
    "ciclo": "NA",
    "total": 459
  },
  {
    "facultad": "Facultad de Ingeniería",
    "carrera": "Ingeniería de Sistemas",
    "ciclo": "NA",
    "total": 382
  },
  {
    "facultad": "Facultad de Psicología",
    "carrera": "Psicología",
    "ciclo": "NA",
    "total": 316
  }
]