[
  {
    "facultad": "Otra",
    "carrera": "Administración",
    "ciclo": "NA",
    "total": 83
  },
  {
    "facultad": "Otra",
    "carrera": "Arquitectura",
    "ciclo": "NA",
    "total": 22
  },
  {
    "facultad": "Otra",
    "carrera": "Comunicación",
    "ciclo": "NA",
    "total": 139
  },
  {
    "facultad": "Otra",
    "carrera": "Contabilidad y Finanzas",
    "ciclo": "NA",
    "total": 12
  },
  {
    "facultad": "Otra",
    "carrera": "Derecho",
    "ciclo": "NA",
    "total": 45
  },
  {
    "facultad": "Otra",
    "carrera": "Economía",
    "ciclo": "NA",
    "total": 14
  },
  {
    "facultad": "Otra",
    "carrera": "Ingeniería Ambiental",
    "ciclo": "NA",
    "total": 1
  },
  {
    "facultad": "Otra",
    "carrera": "Ingeniería Civil",
    "ciclo": "NA",
    "total": 22
  },
  {
    "facultad": "Otra",
    "carrera": "Ingeniería Industrial",
    "ciclo": "NA",
    "total": 145
  },
  {
    "facultad": "Otra",
    "carrera": "Ingeniería de Sistemas",
    "ciclo": "NA",
    "total": 29
  },
  {
    "facultad": "Otra",
    "carrera": "Negocios Internacionales",
    "ciclo": "NA",
    "total": 39
  },
  {
    "facultad": "Otra",
    "carrera": "Psicología",
    "ciclo": "NA",
    "total": 47
  }
]